Model,Chunk,Section,Strengths,Weaknesses,Suggestions
gpt-4.1,Pages 1–3,Abstract,Clearly states the survey scope and motivation.; Highlights integration of classical and modern ML-based approaches.; Mentions privacy and scalability concerns well.,"Abstract is dense and very technical, which might challenge non-expert readers.",Consider slightly simplifying abstract language for accessibility.
gpt-4.1,Pages 1–3,Introduction,Well motivated with real-world examples.; Clear statement of contributions and survey organization.,Some statements about AI in general could be shortened to focus more on database indexing and clustering.,Focus introduction more tightly on survey core topics.
gpt-4.1,Pages 1–3,"1.1, 1.2, 1.3 Motivation and Overview",Detailed motivation for indexing and clustering relevance.; Good coverage of advances with theoretical and practical perspectives.; Clear outline of survey structure.,Dense theoretical references might overwhelm some readers.,Include brief lay explanations or examples for complex theory points.
gpt-4.1,Pages 1–3,2 Classical and Hybrid Database Indexing Techniques,Comprehensive review of classical indexing methods and their limitations.; Good explanation of hybrid indexing innovations with examples like Griffin.; Tables referenced to summarize key features.,Table(s) are mentioned but not seen; visuals integration could be improved.,Ensure tables and figures are explicitly given and well integrated with text.
gemini-2.5,Pages 1–3,Abstract,Clearly states survey objectives and scope.; Highlights motivation and significance of the topic.; Outlines the main contributions succinctly.,Complex phrasing may reduce accessibility for non-expert readers.,Simplify some sentences for better readability.
gemini-2.5,Pages 1–3,Introduction,Provides strong motivation with relevant examples.; Clearly outlines survey structure and contributions.; Defines challenges motivating research.,Somewhat dense; could benefit from more illustrative figures or summaries.,Include an overview figure of survey taxonomy to aid reader navigation.
gemini-2.5,Pages 1–3,1.1 Motivation for Efficient Indexing in Database Systems and Advances in Clustering and Range Searching,Effectively connects classical challenges with theoretical advances.; References rigorous results linking combinatorial geometry to indexing.,Technical depth may overwhelm readers unfamiliar with discrepancy theory.,Add brief intuitive explanations or examples for complex theories.
gemini-2.5,Pages 1–3,2 Classical and Hybrid Database Indexing Techniques,Clear explanations of classical indexing methods.; Highlights tradeoffs and challenges effectively.; Introduces hybrid indexing with concrete example (Griffin).,Limited number of tables or diagrams to illustrate structures mentioned.,Add visual aids such as diagrams of index structures and performance comparisons.
claude-3.7,Pages 1–3,Abstract,Clearly states comprehensive survey scope and goals.; Effectively motivates the importance and interdisciplinary nature.; Highlights machine learning and privacy-preserving mechanisms.,Some terminology dense which may challenge non-expert readers.,Consider simplifying some abstract sentences for broader accessibility.
claude-3.7,Pages 1–3,Introduction,Well-structured with clear motivation and research contributions.; Uses concrete motivating examples for clarity.; Outlines survey organization clearly.,Could better highlight how the survey differs from prior works explicitly.,Add brief explicit statement contrasting prior surveys.
claude-3.7,Pages 1–3,1.1 Motivation for Efficient Indexing in Database Systems and Advances in Clustering and Range Searching,Strong theoretical foundation linked to combinatorial geometry.; Clearly explains challenges with classical indexing on multidimensional data.,References predominantly older foundational works.,Include more recent advances in indexing scalability if possible.
claude-3.7,Pages 1–3,1.2 Importance of Range Search and Clustering Techniques in Modern Data Analysis,Effectively connects theory to practical applications in varied domains.; Describes advanced polynomial partitioning and dynamic data structures.,Complex technical descriptions could be supported with illustrative figures.,Add schematic or example figure to aid reader comprehension.
claude-3.7,Pages 1–3,"1.3 Overview of Survey Structure Covering Classical and Machine Learning-Based Indexing, Clustering Algorithms, Point Set Registration, Optimization Frameworks, and Privacy Preservation",Comprehensive outline linking classical and modern approaches.; Clear roadmap with interdisciplinary connections.,Summary could better emphasize novel contributions.,Highlight unique perspectives or synthesis more explicitly.
claude-3.7,Pages 1–3,2 Classical and Hybrid Database Indexing Techniques,Detailed description of classical methods and deployment issues.; Introduces hybrid indexing with example of Griffin scheme thoroughly.,Table 1 referenced but not fully shown in provided text.; Some sections dense and may benefit from bullet points or visuals.,Include Table 1 fully and add illustrative diagrams of hybrid index architecture.
gpt-4.1,Pages 4–6,2.3 Challenges and 2.4 Integration of Various Indexing Paradigms,Clear presentation of key challenges in classical and hybrid indexing.; Good use of examples such as Griffin for hybrid index design.; Insightful discussion of trade-offs and system-level complexities.,Some technical details and assumptions may require prior reader expertise.; Could include more explicit summaries within subsections.,Add explicit summary paragraphs to reinforce main points at section end.; Consider clarifying technical terms or providing brief definitions.
gpt-4.1,Pages 4–6,3 Machine Learning and Reinforcement Learning-Based Indexing Techniques,"Comprehensive coverage of ML and RL techniques for indexing.; Detailed comparison of methods in Table 2 highlighting multiple evaluation metrics.; Discussion of practical challenges like retraining, model complexity, and adaptability.; Inclusion of a taxonomy helps organize learned indexing approaches.",Some analysis is descriptive; deeper theoretical insights or performance tradeoffs could be explored.; Future directions are broad; more focused research questions could help.,Include case studies or deeper quantitative analysis where possible.; Focus future directions on actionable research challenges.
gpt-4.1,Pages 4–6,3.6 Deep Learning for Biometric Indexing and 3.7 Reinforcement Learning Framework for Automated Index Selection,Shows practical applications of deep learning for indexing in biometrics with clear performance metrics.; Presents RL-based index selection framework with empirical results and limitations.; Highlights current state-of-the-art and opportunities for improvement.,Could benefit from more detailed explanation of RL algorithms for readers unfamiliar with them.; The presentation of challenges is somewhat brief relative to potential complexity.,Expand on RL technical details or provide references for background.; Provide explicit discussion on integration with traditional indexing techniques.
gemini-2.5,Pages 4–6,2.3 Challenges,"Clearly states multiple technical challenges in classical and hybrid indexing.; Provides concrete examples (e.g., Griffin) linking challenges to solutions.",Could benefit from clearer subheadings to separate different challenges.; Some technical terms could be further explained for clarity.,Add brief introductory paragraph summarizing challenges before detailed listing.; Incorporate more citations to recent advances addressing these challenges.
gemini-2.5,Pages 4–6,2.4 Integration of Various Indexing Paradigms,Effectively discusses synergy between hash-based and tree-based indexing.; Supports claims with empirical results demonstrating performance improvements.,Discussion somewhat focused on specific example (Griffin); could expand to other systems.; Complexity discussion could use more elaboration on trade-offs.,Include broader survey of hybrid indexing architectures beyond Griffin.; Clarify and highlight trade-offs between complexity and performance for practitioners.
gemini-2.5,Pages 4–6,3 Machine Learning and Reinforcement Learning-Based Indexing Techniques,"Comprehensive coverage of ML and RL models applied to indexing, including taxonomy.; Discusses challenges like dataset dynamics and retraining overhead clearly.; Includes empirical performance comparisons in tables.","Some concepts (e.g., RMI, PPO) assumed known; could benefit from brief explanations.; Sections are dense and could be broken into smaller subsections for readability.",Add brief explanations or definitions for specialized ML/RL terms.; Split long sections into more focused subsections with clear headings.
claude-3.7,Pages 4–6,2.3 Challenges,"Clearly identifies key challenges in classical and hybrid indexing techniques.; Good explanation of concurrency, consistency, and trade-offs in distributed environments.",Could further elaborate on impact of challenges with specific examples.,Include more concrete case studies illustrating challenges in practical deployments.
claude-3.7,Pages 4–6,2.4 Integration of Various Indexing Paradigms,Effective discussion on how hybrid indexes like Griffin combine methods to optimize performance.; Tables and empirical results strengthen arguments.,Technical details could be expanded to explain algorithmic mechanisms better.,Add diagrams or workflows illustrating hybrid index operations.
claude-3.7,Pages 4–6,3 Machine Learning and Reinforcement Learning-Based Indexing Techniques,Comprehensive coverage of ML and RL methods and their challenges.; Good taxonomy categorizing learned multidimensional indexing methods.; Well explained RL framework for automated index selection with empirical validation.,Some technical jargon may be challenging for non-specialist readers.,Introduce brief primer on ML/RL concepts to aid accessibility.; Expand discussion on limitations and open problems in learned index applications.
gpt-4.1,Pages 7–9,"4 Integrative Advances in Indexing, Clustering, Range Searching, and Optimization","Comprehensive coverage of classical, hybrid, and learned indexing methods.; Clear explanation of reinforcement learning application and recent advances.; Insightful discussion on challenges like high-dimensionality and dynamic adaptation.; Effective use of tables summarizing methods and frameworks.; Balanced discussion on trade-offs and future research directions.","Explicit objectives are not clearly stated within this section.; Some transitions between subsections could improve coherence.; A few references are somewhat dated, limiting currency slightly.; Moderate bias toward reinforcement learning-driven approaches.; Some technical terms could be better defined for clarity.",Include explicit objective statements early in the section for clarity.; Enhance transitions and link discussion points more seamlessly.; Incorporate more recent references if possible to improve currency.; Provide brief definitions of specialized terms within the section.; Balance discourse with alternative indexing strategies beyond RL and learned indexes.
gemini-2.5,Pages 7–9,"4 Integrative Advances in Indexing, Clustering, Range Searching, and Optimization",Comprehensive coverage of classical and learned indexing approaches.; Clear discussion of reinforcement learning applications for dynamic index adaptation.; Good identification of key challenges especially for high-dimensional and dynamic data.; Inclusion of tables summarizing indexing and clustering methods enhances understanding.; Strong integration of multiple indexing paradigms including hybrid methods and learned indexes.,Some sections are dense with complex terminology that may challenge less expert readers.; Analysis tends toward descriptive with limited critical evaluation of competing approaches.; Occasional lengthy paragraphs reduce readability.; Some future directions are broadly stated without detailed technical pathways.,"Add clearer, concise summary paragraphs to reinforce key insights at section ends.; Include more critical comparison and evaluation of methods' limitations and trade-offs.; Break longer sections into smaller subsections for better clarity.; Expand on specific technical challenges in implementing RL and learned methods in index tuning."
claude-3.7,Pages 7–9,"4 Integrative Advances in Indexing, Clustering, Range Searching, and Optimization","Comprehensive coverage of classical, hybrid, learned, and reinforcement learning approaches.; Clear explanation of trade-offs, challenges, and future directions in multidimensional indexing.; Effective use of tables summarizing frameworks and methods enhances understanding.; Discussion of dynamic adaptation using RL is up-to-date and insightful.",Some section headings are lengthy and complex which slightly hinders quick navigation.; A few sentences are dense and could be clearer with simpler phrasing.; Currency of cited literature is good but could more strongly emphasize very recent (past 2 years) works.,"Consider shortening or breaking down long section titles for readability.; Simplify complex sentences to improve accessibility.; Add more current references (e.g., 2022-2024) to strengthen currency and relevance."
gpt-4.1,Pages 10–12,"5 Clustering: Algorithms, Frameworks, and Applications",Comprehensive discussion of hierarchical clustering advances with theoretical guarantees.; Inclusion of large-scale and privacy-preserving clustering methods.; Covers diverse clustering modalities such as time-series and heterogeneous networks.,Some parts are dense and use technical jargon that might challenge less expert readers.; Limited visual aids beyond a single summary table to clarify complex concepts.,Introduce additional figures or flowcharts to illustrate algorithmic frameworks like Hunter or tangle-based clustering.; Provide clearer sub-section separation to improve readability.
gpt-4.1,Pages 10–12,5.1 Point Set Registration and Robust Correspondence Frameworks,Detailed explanation of hypergraph and fuzzy correspondence methods for robust registration.; Highlights state-of-the-art frameworks with empirical comparison to baselines.; Addresses parameter tuning and scalability challenges candidly.,The dependency on initial conditions for Hunter and need for adaptive parameter optimization could be more deeply analyzed.; Section ends abruptly without covering conclusions or future work in registration extensively.,Add a concluding paragraph that summarizes key takeaways and outlines future research directions in point set registration.; Expand discussion on integration of learning-based methods as a future direction.
gemini-2.5,Pages 10–12,"5 Clustering: Algorithms, Frameworks, and Applications",Thorough coverage of hierarchical clustering theoretical advances and practical scalability solutions.; Insightful discussion on privacy-preserving federated clustering and big data challenges.; Integration of domain knowledge and combinatorial methods adds novelty.,Parameter tuning challenges and scalability issues are acknowledged but not deeply probed.; Some discussion could benefit from clearer separation of frameworks versus application contexts.,Expand on adaptive parameter tuning methodologies or automated tuning.; Consider clearer subsections for distinct clustering modalities and applications for easier navigation.
gemini-2.5,Pages 10–12,5.1 Point Set Registration and Robust Correspondence Frameworks,Clear presentation of advanced frameworks like Hunter hypergraph and fuzzy correspondence models.; Strong empirical validation cited with datasets and benchmarks.; Good linkage between geometric theory and practical registration use cases.,Some technical details on algorithmic complexity and limitations could enhance understanding.; Discussion focuses heavily on rigid registration; more on non-rigid approaches could be developed.,Include more comparative complexity analysis or runtime considerations.; Expand discussion on non-rigid registration challenges and future research opportunities.
claude-3.7,Pages 10–12,"5 Clustering: Algorithms, Frameworks, and Applications","Comprehensive discussion of hierarchical, privacy-preserving, and big data clustering.; Clear explanations of theoretical advances and practical impact.; Integration of domain knowledge and privacy concerns is well covered.",Some sections dense with technical detail that may challenge less specialized readers.; Parameter tuning challenges mentioned but could be expanded with examples.,Add illustrative examples or case studies to clarify complex methods.; Expand on practical guidelines for hyperparameter tuning in clustering frameworks.
claude-3.7,Pages 10–12,5.1 Point Set Registration and Robust Correspondence Frameworks,Accurate coverage of state-of-the-art registration methods with hypergraph and fuzzy models.; Good explanation of challenges and advantages of new frameworks like Hunter.; Clear discussion of computational trade-offs and future directions.,Dependence on initial matches and parameter tuning challenges noted but could have more detail on mitigation.; Some technical terms introduced without lay descriptions.,Include more background or primer for complex concepts like hypergraphs.; Add illustrative comparison tables or figures highlighting method performance.
gpt-4.1,Pages 13–15,5.1.3 Discussion,Clearly discusses comparative strengths and weaknesses of Hunter and fuzzy correspondence frameworks.; Points out key challenges and articulates future research directions.; Provides a balanced view integrating probabilistic and structural approaches.,Dense paragraphs may reduce clarity for some readers.,Include more subheadings or paragraph breaks for easier reading.; Add illustrative figures or diagrams for conceptual frameworks.
gpt-4.1,Pages 13–15,6 Global Optimization and Algorithmic Enhancements,Detailed description and pseudocode of novel PROS algorithm improves reproducibility.; In-depth discussion of adaptive extensions and empirical evaluations.; Highlights relevance to real-world applications and complex scenarios.,Some jargon-heavy explanations could be simplified for broader accessibility.,Provide example applications or case studies for PROS in more detail.; Include flow diagrams of the PROS algorithm.
gpt-4.1,Pages 13–15,7 Hardware Acceleration and Privacy-Preserving Data Markets,"Comprehensive coverage of hardware acceleration for privacy-preserving data markets.; Discusses FPGA implementations, co-design strategies, and privacy threats.; TPDM framework well explained with real-world evaluations.",Complex cryptographic concepts might benefit from simplified explanations.,Add diagrams illustrating hardware-software co-design and TPDM architecture.; Expand discussion on limitations and potential alternative frameworks.
gemini-2.5,Pages 13–15,"Integrative Advances in Indexing, Clustering, Range Searching, and Optimization",Provides detailed comparison and discussion of Hunter and fuzzy correspondence frameworks with clear identification of benefits and issues.; Effectively discusses future directions and challenges in point set registration.; Includes useful tables summarizing key challenges and opportunities.,Objectives of the survey are not explicitly stated.; Some technical jargon and dense descriptions may limit accessibility to less specialized readers.,Add explicit objectives in introduction or abstract for clarity.; Consider including illustrative diagrams to complement dense textual descriptions.
gemini-2.5,Pages 13–15,6 Global Optimization and Algorithmic Enhancements,"Detailed explanation of the PROS algorithm with pseudocode enhances reproducibility.; Analysis balances practical implementation with theoretical insight.; Discusses pros and cons, along with potential adaptive improvements.",Limited discussion on empirical benchmarks referenced; including example results or figures would strengthen claims.; Some concepts like orthogonality constraints may benefit from additional clarification.,Include figures or tables showing benchmark performance to reinforce effectiveness claims.; Explain key technical terms more accessibly.
gemini-2.5,Pages 13–15,7 Hardware Acceleration and Privacy-Preserving Data Markets,Thorough overview of FPGA-based acceleration highlighting practical advancements and challenges.; In-depth discussion of the TPDM framework with real-world evaluation summaries.; Good synthesis of hardware and cryptographic approaches with future research outlook.,Some sections are dense and might be improved with graphical schematics of hardware architectures or data flows.; Background on cryptographic techniques could be briefly summarized to help interdisciplinary readers.,Add schematic diagrams of hardware-accelerated pipeline and TPDM framework.; Provide brief primers or references for specialized cryptographic methods.
claude-3.7,Pages 13–15,5.1.3 Discussion and 6 Global Optimization and Algorithmic Enhancements,Detailed comparison between Hunter and fuzzy correspondence frameworks with clear explanation of benefits and limitations.; In-depth description and pseudocode for PROS algorithm with applicability discussion and future directions.; Comprehensive table summarizing challenges and future research directions for point set registration frameworks.; Good coverage of hardware acceleration and privacy-preserving data market frameworks with integration of real-world application examples.; Clear articulation of future research gaps and challenges.,Some paragraphs are dense and could benefit from further sub-sectioning or clearer signaling of key points.; Limited visual aids beyond tables; flowcharts or diagrams explaining algorithm flow or hardware architecture would improve clarity.; Some technical jargon and abbreviations may challenge readers less familiar with specific subdomains.,Add more diagrams or flowcharts to visually represent the PROS algorithm and hardware-accelerated query processing.; Provide clearer subsection headings to break down long textual blocks for easier navigation.; Consider including a concise summary paragraph at the end of each major subsection to reinforce key takeaways.
gpt-4.1,Pages 16–18,8 Discussion and Future Directions,Comprehensive coverage of key challenges and future research avenues.; Clear synthesis linking back to surveyed frameworks.; Effective summary tables organizing challenges and opportunities.,Explicit statement of objectives could be stronger in this section alone.; Slightly dense with technical jargon which might limit accessibility to non-expert readers.,Include a brief explicit statement of survey objectives within this section or introduction.; Consider adding a glossary or brief explanations of technical terms for wider audience accessibility.
gpt-4.1,Pages 16–18,8.1 Core Themes & 8.2 Open Challenges,"Insightful discussion on multi-dimensional optimization challenges.; Integration of diverse methods including privacy, efficiency, and scalability.; Detailed open challenges with contextual examples enhancing clarity.",Some paragraphs are long and may benefit from further subdivision.; Parameter sensitivity discussions could be supplemented with quantitative comparisons.,Break down longer paragraphs for readability.; Add quantitative comparisons or references to benchmarks where feasible.
gpt-4.1,Pages 16–18,"8.2.x Specific Research Areas (e.g., Scalability, Approximate Algorithms, Validation Metrics)",Thorough treatment of state-of-the-art techniques and limitations.; Bridges gap between theory and application effectively.; Recognizes emerging hardware and federated learning paradigms.,"The depth of mathematical or algorithmic details is limited, possibly due to survey scope.; Some future directions are broad and could be more specific.",Include illustrative figures or pseudocode snippets for complex algorithmic paradigms.; Narrow down some future directions with more concrete examples or milestones.
gemini-2.5,Pages 16–18,8 Discussion and Future Directions,"Comprehensive synthesis of challenges and research opportunities; Detailed discussion of balancing efficiency, privacy, and heterogeneity; Insightful identification of open challenges with examples; Clear tables summarizing challenges and directions; Strong integration of frameworks with future research paths",Objectives could be more explicitly stated at the start; Some highly technical descriptions might limit accessibility for broader audiences,Explicitly state objectives or goals earlier in the survey for reader clarity; Consider adding simplified summaries or graphical abstracts for complex sections
claude-3.7,Pages 16–18,8 Discussion and Future Directions,"Clearly outlines major challenges and ties them to specific future research directions.; Provides a comprehensive table summarizing challenges and research opportunities.; Integrates discussion of scalability, privacy, interpretability, and hardware acceleration cohesively.",Objectives could be stated more explicitly at the beginning of the survey for clarity.; Minor flow issues between highly technical subsections might affect readability for broader audience.,Add explicit statement of survey objectives in the introduction.; Enhance transitions between subsections to improve narrative flow.; Include more explicit links between surveyed frameworks and the future challenges table.
