Model,Chunk,Section,Strengths,Weaknesses,Suggestions
claude-3.7,Pages 16–18,8.1 Core Themes,"Effectively synthesizes challenges across clustering, indexing, range searching, and registration.; Discusses trade-offs among efficiency, privacy, and heterogeneity well.; Cites specific algorithmic examples to illustrate points.",Could elaborate more on practical implications of each theme.; Some technical terminology may require brief definitions for interdisciplinary clarity.,Incorporate practical case studies or real-world examples.; Add brief glossary or definitions for technical terms.
claude-3.7,Pages 16–18,8.2 Open Challenges,"Detailed list and explanation of current open problems with clear illustrative examples.; Strong multidimensional perspective covering interpretability, data quality, robustness, scalability, and privacy.; Well structured with subsections addressing challenge-specific research directions.",Could further prioritize challenges by their impact or urgency.; Some sections could be shortened for conciseness.,Consider highlighting top 3-4 priority challenges for focus.; Condense some detailed descriptions to maintain reader engagement.
gpt-4.1,Pages 19–21,8.2.6 Incorporation of Ontologies and Adaptive Updates in Domain-Aware Clustering,Clear explanation of the role of ontologies for semantic clustering enhancement.; Recognition of computational overhead and ontology completeness as challenges.,Could elaborate on specific adaptive update mechanisms and practical examples.,Include concrete case studies or algorithms that implement continuous ontology updates.
gpt-4.1,Pages 19–21,8.3 Synergistic Opportunities,Strong integration of AI methodologies illustrating benefits and challenges.; Table 10 effectively summarizes challenges and future directions.; Concrete examples like robotics manipulation given.,Some discussions on trade-offs and incompatibilities are high level without detailed solutions.,Elaborate on methods proposed to handle computational complexity and paradigm incompatibility.
gpt-4.1,Pages 19–21,"8.3.1 Cross-Fertilization Among Global Optimization, Approximate Nearest Neighbor Search, Clustering Validation, and Point Registration","Insightful multi-disciplinary cross-pollination promoting robustness and interpretability.; Examples of PROS, HNSW, and hybrid indexing illustrate theory-practice connections.",Some technical terms and methods could be better explained for clarity.,Add brief primers or references for less common techniques to aid reader understanding.
gpt-4.1,Pages 19–21,"8.4 Future Trends and 8.4.1 Emergence of Hybrid, Interpretable, Distributed AI-Driven Models","Well-identified future research directions aligning with explainable AI, multi-modal systems, and privacy.; Detailed examples like RL-based indexing and deep hashing contextualize trends.",Challenges like efficiency and ethical concerns mentioned but could benefit from proposing specific mitigation strategies.,Incorporate emerging best practices or frameworks to handle computational demands and privacy.
gpt-4.1,Pages 19–21,9 Conclusion and 9.1 Summary of Surveyed Advances,"Comprehensive summary articulates strengths, weaknesses, and areas for growth.; Acknowledges limitations transparently, encourages future research.",Summary tables (referenced) are useful but could be more prominent and varied.,Expand summarization visuals and include more comparative analyses to support conclusions.
gemini-2.5,Pages 19–21,8 Integrative Advances and Future Trends,"Comprehensive coverage of synergistic AI techniques integrating optimization, clustering, and indexing.; Clear discussion of challenges and opportunities with forward-looking perspectives.; Good use of examples (e.g., robotic manipulation with RL and symbolic reasoning).; Table 10 effectively summarizes challenges and future research directions.","Some subsections have dense text that may benefit from more figures or diagrams for clarity.; Although gaps and challenges are identified, some future directions are described at a high level without detailed actionable steps.","Incorporate additional illustrative visuals or diagrams to complement complex ideas.; Expand on specific evaluation benchmarks or metrics for synergistic frameworks in future work.; Improve formatting consistency to enhance readability, especially in dense paragraphs."
gemini-2.5,Pages 19–21,9 Conclusion and Summary,Provides a solid summary table and clear acknowledgment of survey limitations.; Offers actionable suggestions for future research and practical application.; Clear and accessible language with encouragement for reader engagement.,Summary might benefit from more explicit prioritization of future work areas.; Glossary placement in appendix is useful but not mentioned more prominently in text.,Include a brief roadmap or prioritized next steps in conclusion for better guidance.; Mention glossary references more throughout the text to aid diverse readership.
claude-3.7,Pages 19–21,8.2.6 Incorporation of Ontologies and Adaptive Updates in Domain-Aware Clustering,Clear explanation of integrating domain semantics via ontologies.; Identification of computational trade-offs and dependency on ontology quality.,Lacks detailed examples of specific ontology-update algorithms.,Include illustrative case studies of adaptive ontology updates in practice.
claude-3.7,Pages 19–21,8.3 Synergistic Opportunities,"Well-articulated synergies between reinforcement learning, symbolic reasoning, and other AI methods.; Balanced discussion of benefits and challenges including complexity and compatibility.",Could improve by deeper evaluation of trade-offs in hybrid models.,Add quantitative or empirical evidence illustrating synergy benefits.
claude-3.7,Pages 19–21,"8.3.1 Cross-Fertilization Among Global Optimization, Approximate Nearest Neighbor Search, Clustering Validation, and Point Registration",Insightful explanation of interdisciplinary connections enhancing robustness and interpretability.; Presented practical algorithmic details like PROS and HNSW graphs.,Could expand on limitations and open research questions within these combinations.,Highlight unresolved challenges or benchmarks lacking for cross-method evaluation.
claude-3.7,Pages 19–21,8.4 Future Trends,"Clearly identifies emerging trends such as explainable AI integration and multimodal systems.; Addresses practical challenges, including ethical and computational constraints.",Some future direction descriptions are broad and could benefit from concrete research questions.,Propose specific experimental frameworks or datasets for validating future approaches.
claude-3.7,Pages 19–21,"8.4.1 Emergence of Hybrid, Interpretable, Distributed AI-Driven Models",Good coverage of hybrid models and privacy-preserving technologies.; Examples like ART and federated learning provide concrete illustrations.,Could further discuss scalability limits and latency concerns in distributed models.,Include performance comparisons or benchmarks for hybrid models in real-world workflows.
claude-3.7,Pages 19–21,8.4.2 Continued Interdisciplinary Research,"Emphasizes need for ongoing effort crossing cryptography, machine learning, and domain expertise.; Highlights adaptive indexing and privacy as key interdisciplinary challenges.",Limited detailed roadmap or prioritized research agenda.,Outline a clear set of next steps or workshop-style research initiatives.
claude-3.7,Pages 19–21,9 Conclusion and 9.1 Summary of Surveyed Advances,Effective summary of key advances with examples and citations.; Acknowledges limitations and encourages critical analysis.,Could strengthen future outlook with more actionable recommendations.,Add a concluding roadmap figure or table synthesizing opportunities and challenges.
gpt-4.1,Pages 22–24,9.2 Methodological Innovations Bridging Theory and Practice,"Clear link made between theoretical advances and practical algorithm design.; Insightful discussion of polynomial partitioning, discrepancy theory, and dynamic data structures with formal performance guarantees.",Some technical details might be dense for readers not specialized in combinatorial geometry.,Consider adding a brief intuitive summary or example to illustrate key theoretical concepts.
gpt-4.1,Pages 22–24,"9.3 Privacy-Conscious Frameworks, Federated Learning, and Cryptographic Guarantees","Comprehensive coverage of cryptographic techniques, federated learning, and differential privacy.; Good integration of privacy concerns with real-world applications and system implementations.",Could benefit from clearer separation of techniques versus applications for easier readability.,Add a schematic or flow diagram to outline privacy frameworks visually.
gpt-4.1,Pages 22–24,"9.4 Outlook on Intelligent Systems with Interpretable, Hybrid, and Distributed Models",Forward-looking and well-structured perspective on interpretable and hybrid indexing methods.; Balances technical challenges and promising approaches clearly.,Lengthy subsections could be more concisely summarized.,Add bullet points to highlight key promises and challenges for reader clarity.
gpt-4.1,Pages 22–24,9.5 Call for Ongoing Interdisciplinary Efforts,Strong identification of hierarchical challenges with research questions and methodological suggestions.; Tables provide clear roadmap for future research.,Occasional complex sentence structures reduce accessibility.,Simplify language and add concrete examples of interdisciplinary collaborations.
gemini-2.5,Pages 22–24,9.2 Methodological Innovations Bridging Theory and Practice,Connects theoretical foundations with practical algorithm design effectively.; Presents rich examples of theory-driven advancements with formal performance guarantees.,Could provide more explicit contextualization of certain technical methods for broader accessibility.,Add more intuitive explanations or illustrations for complex algebraic geometry concepts.
gemini-2.5,Pages 22–24,"9.3 Privacy-Conscious Frameworks, Federated Learning, and Cryptographic Guarantees",Highlights critical privacy-preserving methods integrating cryptography and differential privacy.; Covers recent frameworks with practical applications demonstrating privacy-utility trade-offs.,Details on computational costs and scalability could be expanded.,Include discussion on performance benchmarks or overheads of privacy mechanisms.
gemini-2.5,Pages 22–24,"9.4 Outlook on Intelligent Systems with Interpretable, Hybrid, and Distributed Models",Offers a forward-looking perspective on hybrid and distributed models blending interpretability and scalability.; Effectively discusses challenges and trade-offs in system complexity and real-time responsiveness.,Some emerging techniques like reinforcement learning could be discussed with deeper technical insights.,Incorporate more detailed comparisons of hybrid indexing approaches and their tuning complexities.
gemini-2.5,Pages 22–24,9.5 Call for Ongoing Interdisciplinary Efforts,"Clearly categorizes challenges into foundational, methodological, and system levels.; Poses well-defined research questions and proposes methodological directions.; Synthesizes interdisciplinary collaboration needs for future advancement.",Could benefit from more concrete examples of successful interdisciplinary efforts.,Add case studies or lessons learned from existing interdisciplinary projects.
claude-3.7,Pages 22–24,9.2 Methodological Innovations Bridging Theory and Practice,Provides strong connection between deep theoretical foundations and practical algorithm designs.; Discusses cutting-edge methods such as polynomial partitioning and discrepancy theory.; Explains bridging of static and dynamic data structures effectively.,Complex technical jargon could be challenging for less specialized readers.; Opportunities for clearer examples to improve accessibility.,Include simplified summaries or examples to clarify highly technical content.; Add diagrams or illustrations if possible to support comprehension.
claude-3.7,Pages 22–24,"9.3 Privacy-Conscious Frameworks, Federated Learning, and Cryptographic Guarantees","Clearly demonstrates importance of privacy in distributed systems.; Reviews advanced privacy technologies including differential privacy, multiparty computation, and encryption.; Provides real-world examples like Longshot and federated learning for practical context.",Some technical descriptions are dense and may benefit from additional explanation.,Expand on practical implications or limitations of privacy frameworks.; Provide comparative summary to highlight trade-offs more explicitly.
claude-3.7,Pages 22–24,"9.4 Outlook on Intelligent Systems with Interpretable, Hybrid, and Distributed Models",Forward-looking discussion addressing emerging trends in interpretable and hybrid models.; Balances potential with challenges effectively.; Offers concrete examples of novel methods like Information-Ordered Bottlenecks and hybrid indexing.,Heavy content density could hinder some readers’ understanding.,Consider breaking up dense paragraphs for readability.; Use bullet points or callouts for major challenges and future directions.
claude-3.7,Pages 22–24,9.5 Call for Ongoing Interdisciplinary Efforts,"Synthesizes challenges clearly across foundational, methodological, and system levels.; Provides a well-structured roadmap for future research with detailed research questions.; Integration of cross-disciplinary fields is well articulated.",Could offer more concrete next steps or milestone goals for interdisciplinary collaboration.,Highlight key achievable objectives for near-term research impact.; Include potential collaboration models or examples.
